{
  "ablation_dimensions": [
    "local_aligner",
    "mosaic",
    "dense_k31_rescue",
    "k21_rescue",
    "common_sequence_evidence",
    "selective_reads"
  ],
  "accuracy_note": "final_recall means aligned trace recovery where expected_final is present; it is not an autonomous plasmid confirmation call",
  "generated_at_utc": "2026-08-23T19:27:25.148473+00:00",
  "groups": [
    {
      "ablation": {
        "common_sequence_evidence": "unavailable",
        "dense_k31_rescue": "unavailable",
        "k21_rescue": "unavailable",
        "local_aligner": "unavailable",
        "mosaic": "unavailable",
        "selective_reads": "unavailable"
      },
      "alignment_count": {
        "bootstrap_95": [
          2.0,
          56.0
        ],
        "median": 2.0,
        "p90": 56.0,
        "p95": 56.0,
        "p99": 56.0,
        "query_count": 3
      },
      "break_even_queries_cpu": null,
      "break_even_queries_wall": null,
      "cache_state": "cold",
      "candidate_count": {
        "bootstrap_95": [
          2.0,
          28.0
        ],
        "median": 2.0,
        "p90": 28.0,
        "p95": 28.0,
        "p99": 28.0,
        "query_count": 3
      },
      "candidate_recall": {
        "median": 1.0,
        "query_count": 3
      },
      "complete_count": 6,
      "cpu_seconds": {
        "bootstrap_95": [
          0.6087795,
          18.857118
        ],
        "median": 2.6174660000000003,
        "p90": 18.857118,
        "p95": 18.878722999999997,
        "p99": 18.896006999999997,
        "query_count": 3
      },
      "cpu_threads": 1,
      "failed_count": 0,
      "false_candidate_count": null,
      "false_candidate_rate": null,
      "final_recall": {
        "median": 1.0,
        "query_count": 3
      },
      "gap_boundary_error_bases": {
        "bootstrap_95": [
          null,
          null
        ],
        "median": null,
        "p90": null,
        "p95": null,
        "p99": null,
        "query_count": 0
      },
      "gap_boundary_error_bases_mean": null,
      "interval_metrics_at_matched_recall": {
        "gap_boundary_error_bases": null,
        "interval_precision": 1.0,
        "interval_recall": 1.0,
        "query_count": 2,
        "status": "available",
        "target": 1.0
      },
      "interval_precision": {
        "bootstrap_95": [
          1.0,
          1.0
        ],
        "median": 1.0,
        "p90": 1.0,
        "p95": 1.0,
        "p99": 1.0,
        "query_count": 3
      },
      "interval_precision_mean": 1.0,
      "interval_recall": {
        "bootstrap_95": [
          0.9980008496389035,
          1.0
        ],
        "median": 1.0,
        "p90": 1.0,
        "p95": 1.0,
        "p99": 1.0,
        "query_count": 3
      },
      "interval_recall_mean": 0.9993336165463012,
      "io_tasks": 1,
      "io_totals": {
        "cache_bytes": 279418812.0,
        "cache_hits": 32430.0,
        "cache_misses": 604.0,
        "decoded_bytes": 603537614.0,
        "get_requests": 0.0,
        "head_requests": 0.0,
        "metadata_requests": 32928.0,
        "range_requests": 32800.0,
        "requested_bytes": 569389582.0,
        "retries": 0.0,
        "returned_bytes": 569389582.0,
        "stale_cache_rejections": 0.0
      },
      "matched_recall_target": 1.0,
      "negative_pair_count": null,
      "peak_rss_kib": {
        "bootstrap_95": [
          208820.0,
          734498.0
        ],
        "median": 452088.0,
        "p90": 734498.0,
        "p95": 740127.0,
        "p99": 744630.2,
        "query_count": 3
      },
      "phase_timing_medians": {
        "trace_total": 2.6490027835025103
      },
      "query_kind": "phage",
      "raw_count": 6,
      "resource_mode": "local",
      "schema_version": "1.0.0",
      "status": "complete",
      "stratum": "phage",
      "sweep_dimension": "baseline",
      "sweep_value": "baseline",
      "system_seconds": {
        "bootstrap_95": [
          0.11313199999999997,
          0.6532419999999999
        ],
        "median": 0.38762149999999995,
        "p90": 0.830055,
        "p95": 0.8876639999999999,
        "p99": 0.9337511999999999,
        "query_count": 3
      },
      "topology": "linear",
      "track": "A",
      "unavailable_count": 0,
      "user_seconds": {
        "bootstrap_95": [
          0.4956475,
          18.203876
        ],
        "median": 2.101846,
        "p90": 18.203876,
        "p95": 18.2130685,
        "p99": 18.220422499999998,
        "query_count": 3
      },
      "wall_seconds": {
        "bootstrap_95": [
          0.6198497950026649,
          19.063630993001425
        ],
        "median": 2.6490027835025103,
        "p90": 19.063630993001425,
        "p95": 19.081808398999783,
        "p99": 19.096350323798468,
        "query_count": 3
      }
    },
    {
      "ablation": {
        "common_sequence_evidence": "unavailable",
        "dense_k31_rescue": "unavailable",
        "k21_rescue": "unavailable",
        "local_aligner": "unavailable",
        "mosaic": "unavailable",
        "selective_reads": "unavailable"
      },
      "alignment_count": {
        "bootstrap_95": [
          3.0,
          3.0
        ],
        "median": 3.0,
        "p90": 3.0,
        "p95": 3.0,
        "p99": 3.0,
        "query_count": 1
      },
      "break_even_queries_cpu": null,
      "break_even_queries_wall": null,
      "cache_state": "cold",
      "candidate_count": {
        "bootstrap_95": [
          3.0,
          3.0
        ],
        "median": 3.0,
        "p90": 3.0,
        "p95": 3.0,
        "p99": 3.0,
        "query_count": 1
      },
      "candidate_recall": {
        "median": 1.0,
        "query_count": 1
      },
      "complete_count": 1,
      "cpu_seconds": {
        "bootstrap_95": [
          0.9525859999999999,
          0.9525859999999999
        ],
        "median": 0.9525859999999999,
        "p90": 0.9525859999999999,
        "p95": 0.9525859999999999,
        "p99": 0.9525859999999999,
        "query_count": 1
      },
      "cpu_threads": 1,
      "failed_count": 0,
      "false_candidate_count": null,
      "false_candidate_rate": null,
      "final_recall": {
        "median": 1.0,
        "query_count": 1
      },
      "gap_boundary_error_bases": {
        "bootstrap_95": [
          null,
          null
        ],
        "median": null,
        "p90": null,
        "p95": null,
        "p99": null,
        "query_count": 0
      },
      "gap_boundary_error_bases_mean": null,
      "interval_metrics_at_matched_recall": {
        "gap_boundary_error_bases": null,
        "interval_precision": 1.0,
        "interval_recall": 1.0,
        "query_count": 1,
        "status": "available",
        "target": 1.0
      },
      "interval_precision": {
        "bootstrap_95": [
          1.0,
          1.0
        ],
        "median": 1.0,
        "p90": 1.0,
        "p95": 1.0,
        "p99": 1.0,
        "query_count": 1
      },
      "interval_precision_mean": 1.0,
      "interval_recall": {
        "bootstrap_95": [
          1.0,
          1.0
        ],
        "median": 1.0,
        "p90": 1.0,
        "p95": 1.0,
        "p99": 1.0,
        "query_count": 1
      },
      "interval_recall_mean": 1.0,
      "io_tasks": 1,
      "io_totals": {
        "cache_bytes": 6440955.0,
        "cache_hits": 890.0,
        "cache_misses": 24.0,
        "decoded_bytes": 14905579.0,
        "get_requests": 0.0,
        "head_requests": 0.0,
        "metadata_requests": 911.0,
        "range_requests": 905.0,
        "requested_bytes": 23054136.0,
        "retries": 0.0,
        "returned_bytes": 23054136.0,
        "stale_cache_rejections": 0.0
      },
      "matched_recall_target": 1.0,
      "negative_pair_count": null,
      "peak_rss_kib": {
        "bootstrap_95": [
          335372.0,
          335372.0
        ],
        "median": 335372.0,
        "p90": 335372.0,
        "p95": 335372.0,
        "p99": 335372.0,
        "query_count": 1
      },
      "phase_timing_medians": {
        "trace_total": 0.9764594709995436
      },
      "query_kind": "phage",
      "raw_count": 1,
      "resource_mode": "local",
      "schema_version": "1.0.0",
      "status": "complete",
      "stratum": "phage",
      "sweep_dimension": "fscale",
      "sweep_value": "20",
      "system_seconds": {
        "bootstrap_95": [
          0.11494599999999999,
          0.11494599999999999
        ],
        "median": 0.11494599999999999,
        "p90": 0.11494599999999999,
        "p95": 0.11494599999999999,
        "p99": 0.11494599999999999,
        "query_count": 1
      },
      "topology": "linear",
      "track": "A",
      "unavailable_count": 0,
      "user_seconds": {
        "bootstrap_95": [
          0.8376399999999999,
          0.8376399999999999
        ],
        "median": 0.8376399999999999,
        "p90": 0.8376399999999999,
        "p95": 0.8376399999999999,
        "p99": 0.8376399999999999,
        "query_count": 1
      },
      "wall_seconds": {
        "bootstrap_95": [
          0.9764594709995436,
          0.9764594709995436
        ],
        "median": 0.9764594709995436,
        "p90": 0.9764594709995436,
        "p95": 0.9764594709995436,
        "p99": 0.9764594709995436,
        "query_count": 1
      }
    },
    {
      "ablation": {
        "common_sequence_evidence": "unavailable",
        "dense_k31_rescue": "unavailable",
        "k21_rescue": "unavailable",
        "local_aligner": "unavailable",
        "mosaic": "unavailable",
        "selective_reads": "unavailable"
      },
      "alignment_count": {
        "bootstrap_95": [
          2.0,
          2.0
        ],
        "median": 2.0,
        "p90": 2.0,
        "p95": 2.0,
        "p99": 2.0,
        "query_count": 1
      },
      "break_even_queries_cpu": null,
      "break_even_queries_wall": null,
      "cache_state": "cold",
      "candidate_count": {
        "bootstrap_95": [
          2.0,
          2.0